id,rule_code,condition,score,priority,max_apply,school,version,status,description
UGS001,GENERATED,Dụng thần được sinh,20,100,3,TRADITIONAL,1.0,active,Được sinh trợ
UGS002,HAS_ROOT,Dụng thần thông căn,18,95,2,TRADITIONAL,1.0,active,Có căn khí
UGS003,SEASON_SUPPORT,Dụng thần đắc lệnh,25,100,1,TRADITIONAL,1.0,active,Đúng mùa
UGS004,COMBINATION_SUPPORT,Hợp hóa trợ Dụng thần,15,90,2,TRADITIONAL,1.0,active,Hợp hóa có lợi
UGS005,LUCK_SUPPORT,Đại vận trợ Dụng thần,20,100,1,TRADITIONAL,1.0,active,Đại vận hỗ trợ
UGS006,YEAR_SUPPORT,Lưu niên trợ Dụng thần,10,85,1,TRADITIONAL,1.0,active,Lưu niên thuận lợi
