rule_id,rule_nhom,dieu_kien,doi_tuong,cach_tinh,chu_ky,mo_ta,trang_thai,phien_ban,ghi_chu
LN001,luu_nien,MacDinh,Nam,LucThapHoaGiap,60,Lưu niên theo Lục Thập Hoa Giáp,active,1.0,
LN002,luu_nien,MacDinh,Can,Tang1,10,Thiên Can tăng tuần hoàn,active,1.0,
LN003,luu_nien,MacDinh,Chi,Tang1,12,Địa Chi tăng tuần hoàn,active,1.0,
LN004,luu_nien,MacDinh,Nam,DongBo,DaiVan,Lưu niên thuộc Đại vận hiện hành,active,1.0,
LN005,luu_nien,MacDinh,Nam,DanhGia,DungThan,Đánh giá theo Dụng Thần,active,1.0,
LN006,luu_nien,MacDinh,Nam,DanhGia,ThanSat,Đánh giá theo Thần sát,active,1.0,
