ma_chu_ky,ten_chu_ky,giai_doan,toc_do_tang_truong,lai_suat,lam_phat,uu_tien_tai_san,han_che_tai_san,chien_luoc_dau_tu,muc_rui_ro,mo_ta,trang_thai
CK001,Suy thoái,Recession,Am,Cao,Trung_Binh,Tien_Mat|Trai_Phieu|Vang,Co_Phieu|Bat_Dong_San,Phong_Thu,Rat_Thap,Kinh tế suy giảm bảo toàn vốn là ưu tiên,active
CK002,Đáy chu kỳ,Bottom,Thap,Bat_Dau_Giam,Thap,Vang|ETF|Co_Phieu_Gia_Tri,Tai_San_Dau_Co,Tich_Luy,Thap,Bắt đầu tích lũy tài sản chất lượng,active
CK003,Phục hồi sớm,Early_Recovery,Tang,Thap,On_Dinh,Co_Phieu|ETF|Logistics,Tien_Mat,Tang_Truong,Trung_Binh,Giai đoạn nền kinh tế phục hồi,active
CK004,Phục hồi mạnh,Recovery,Tang_Nhanh,Thap,On_Dinh,Bat_Dong_San|Co_Phieu|Kinh_Doanh,Vang,Mo_Rong,Cao,Kinh tế tăng trưởng rõ rệt,active
CK005,Tăng trưởng,Expansion,Cao,On_Dinh,Trung_Binh,Bat_Dong_San|Co_Phieu|Cong_Nghe,Tien_Mat,Tang_Truong,Cao,Giai đoạn thuận lợi để mở rộng đầu tư,active
CK006,Bùng nổ,Boom,Rat_Cao,Thap,Lam_Phat_Cao,Cong_Nghe|Khoi_Nghiep|Co_Phieu,Tien_Mat,Chu_Dong,Rat_Cao,Đầu tư chủ động nhưng cần kiểm soát rủi ro,active
CK007,Đỉnh chu kỳ,Peak,Giam_Dan,Tang,Lam_Phat_Cao,Vang|Tien_Mat|Trai_Phieu,Co_Phieu_Dau_Co,Chot_Loi,Trung_Binh,Chốt lời và giảm đòn bẩy,active
CK008,Hạ nhiệt,Slowdown,Cham_Lai,Cao,Giam,Vang|Tien_Mat|Trai_Phieu,Bat_Dong_San,Phong_Thu,Thap,Giảm tốc tăng trưởng và tái cơ cấu danh mục,active
